{
  "schema_version": "1.0.0",
  "manifest": {
    "manifest_id": "MANIFEST-DEMO-PRESENCIAL",
    "created_at": "2026-01-07T12:00:00Z",
    "created_by": {
      "actor_id": "AUTORIDADE (REDACTED)",
      "actor_role": "CONDUTOR"
    },
    "status": "DRAFT"
  },
  "protocol": {
    "name": "Protocolo Nacional de Reconhecimento de Pessoas (PNRP)",
    "portaria": "MJSP nº 1122/2026",
    "ruleset_version": "v0.1.0"
  },
  "case_ref": {
    "case_id": "CASE-DEMO-0001",
    "agency": {
      "name": "Polícia Civil - DEMO",
      "unit": "Unidade DEMO"
    },
    "procedure_number": "0000000/2026"
  },
  "procedure_ref": {
    "recognition_case_ref": {
      "type": "recognition_case.json",
      "id": "examples/presencial/recognition_case.json"
    },
    "modality": "PRESENCIAL",
    "started_at": "2026-01-07T12:00:00Z",
    "ended_at": "2026-01-07T12:15:00Z",
    "timezone": "America/Sao_Paulo"
  },
  "artifacts": [
    {
      "artifact_id": "ART-TERM-0001",
      "artifact_type": "TERMO",
      "created_at": "2026-01-07T12:00:00Z",
      "storage_ref": "STORAGE_REF:DEMO:TERMO/PRESENCIAL",
      "hash_sha256": "0000000000000000000000000000000000000000000000000000000000000000"
    },
    {
      "artifact_id": "ART-VIDE-0001",
      "artifact_type": "VIDEO",
      "created_at": "2026-01-07T12:00:00Z",
      "storage_ref": "STORAGE_REF:DEMO:VIDEO/PRESENCIAL",
      "hash_sha256": "0000000000000000000000000000000000000000000000000000000000000000"
    },
    {
      "artifact_id": "ART-PACK-0001",
      "artifact_type": "PACOTE_ALINHAMENTO_PRESENCIAL",
      "created_at": "2026-01-07T12:00:00Z",
      "storage_ref": "STORAGE_REF:DEMO:PACK/PRESENCIAL",
      "hash_sha256": "0000000000000000000000000000000000000000000000000000000000000000"
    }
  ],
  "custody_log": {
    "events": [
      {
        "event_id": "EVT-000001",
        "at": "2026-01-07T12:00:00Z",
        "actor": {
          "actor_id": "AUTORIDADE (REDACTED)",
          "role": "CONDUTOR"
        },
        "action": "CRIADO",
        "artifact_ref": {
          "artifact_id": "ART-TERM-0001",
          "hash_sha256": "0000000000000000000000000000000000000000000000000000000000000000"
        },
        "event_hash_sha256": "0000000000000000000000000000000000000000000000000000000000000000"
      }
    ],
    "append_only": true
  },
  "integrity": {
    "manifest_hash_sha256": "0000000000000000000000000000000000000000000000000000000000000000",
    "hash_algorithm": "SHA-256",
    "signatures": [
      {
        "signature_id": "SIG-000001",
        "signed_at": "2026-01-07T12:00:00Z",
        "signer": {
          "signer_id": "AUTORIDADE (REDACTED)",
          "role": "CONDUTOR"
        },
        "scope": {
          "covers": "MANIFEST_AND_ALL_ARTIFACTS"
        },
        "signature_format": "INTERNAL",
        "signature_value": "DEMO"
      }
    ]
  }
}
